3983	2	刚买两天就出现这种情况，但是售后还不错。给两??吧。
3984	3	没有什么大的问题 不过  触摸不灵敏 偶尔直接不动
3985	3	最近开机出现暗屏然后卡着的现象，重启后正常，不知道是不是个例
3986	3	开机有时候卡着，不能正常开机，要重启一次才能正常开机。
3987	2	玩个dota2全高也有九十多度，而且有个键不灵了，懒得换了。
3988	3	第二次开机就卡死机了，声音还有点问题，体验不是很好
3989	3	玩lol   Cf都掉帧，是不是只有我的这样，外观还是可以的
3990	3	玩英雄联盟，cpu都能到80度，和电吹风相比，就差风力小了点。
3991	3	外壳有个借着反光才能看出来的小瑕疵，插上电源后c面带电麻手
3992	3	不知道为什么屏幕有点糊，调显示比例游戏和QQ这些总有一个要是糊的
3993	3	电脑很好没有坏的地方，包装方面过于简单连盒子都没有直接一个袋子就送过来了对于这种运送方式没事也算是好运把还有就是没有鼠标背包键盘散热器之类的送实在不满意
3994	2	运行速度：玩了几天英雄联盟，玩的不多，开机几秒总是很卡，总的来说这个价位还这样心里有点不舒服，电脑管家每次运行不开，也懒得找客服，肯定让卸载了重新装，别的游戏也没玩，lol玩起来倒是不烫，但是电池烫的离谱，和朋友的同价位机械师没法比，别的没什么，目前就这样。
3995	2	跑分评测：390000中规中矩 画面品质：友达屏，漏光就算了，屏幕还有一个暗点，虽然不算很显眼，但是强迫症看着不太爽，所以只能给个中评
3996	3	插上充电器 键盘上有静电，有一次开不了机。。。难受
3997	2	才用了12天，电脑不知为何就黑屏开不了了，不知道是不是给我的显卡本身都有问题，按理说驱动应该也没啥问题的吧。还好可以换货，但这出问题的速度也太快了，不知道换了货之后的质量又能怎样，实在有些后悔。 运行速度：i5速度的确比不上i7但是也很不错了 画面品质：144没得说，但是这个出的问题也是显卡的问题，质量有待评估 外形外观：外观酷炫哎，也就是看中它的外观才买的
3998	3	包装保护：包装很简陋，外面就一层薄塑料袋 外形外观：还行吧，但是塑料感肯定比不上金属的y7000p 画面品质：还阔以 跑分评测：第一次35万，第二次34万 运行速度：有时候莫名卡顿 游戏效果：还可以 这是我换新的一台。之前那台肯定是次品，底部有被拆过的痕迹，并且没充电能开机，说明最好还是换了，这一台目前为止挺满意的，就是价格有点虚高
3999	2	其他都还好，就是屏幕顶部漏光什么情况？
4000	3	为什么没有鼠标？鼠标垫也没有一般都会送的吧，况且连背包也没有我怎么拿？
4001	2	电脑到货了，电源线跟变压器的接头是松动的，一动就断电
4002	2	买这么贵的电脑啥也不送，感觉好坑，除了cpu温度高以外，其他都还好
4003	3	电脑运行有点不畅，不知道是网卡还是电脑卡
4004	2	电脑本身还是可以的 但是才买来没两天屏幕就出现蓝线给我整憨了，属实给力嗷
4005	3	不知道为什么这么贵的电脑居然带不动吃鸡，五千多的台式都带的动，其它游戏玩的倒还好
4006	2	跑分评测：2080配置的中配 为什么和别人的跑分错了个5 6万？错一两万我就没这么大的意见 错那么多 难道还有什么设置？G屏给关了 性能模式也开了  电池也调了 电源也插上了 还没用 感觉有点不爽  希望有人能来解答下 包装保护：包装的挺好 并不觉有廉价感 画面品质：画质还好 没有想象中那么的丝滑 外形外观：外形比想象中更有质感 挺好
4007	2	一天蓝屏重启8次，心累
4008	2	总的来讲，性质一半，电量低的时候会卡屏，卡的一动不动跟死机一样
4009	3	跑分和同学的光影5和宏基暗影骑士比都比不过，还比他们贵一点，但是觉得够用了。
4010	3	下载鲁大师，除了硬盘超过全国百分96 其他都是四五十
4011	2	头天中午到货，正常使用一下午，结果第二天起床开机就发现自检报错散热风扇故障。
4012	3	机子还行风扇和温度不夸张，但是第二天蓝屏了，跟国内软件不兼容？
4013	3	刚买几天，有时开不了机，就卡住了，重启一次又可以开机，但是有时还是会发生这种情况。
4014	3	开机速度还行，正常使用还算流畅，风扇声音太大
4015	3	刚开始用还可以，用了不到一个月，硬盘出问题了。
4016	3	价格还行，主板型号太低了，就算是品牌主板，也都早已停产。
4017	3	配置描述属实，电脑挺不错！本来是可以5星的，但是双11说直降200，实际只降189，如果不是帮别人说好买的，依我的性格对于不诚信的我绝对不会买的。所以勉强给3星是给实物
4018	3	用了一个多月，什么都好，就是主机好吵。。。比以前用过的所有都吵
4019	3	办公还可以，想打游戏别买了，玩lol会死机，感觉显卡不行
4020	3	电脑运行还可以，不过，就是安装软件时比较慢。以后不知道怎么样
4021	3	物流是京东转的邮政，京东很快但是转到邮政快递之后，足足耽误了有5天的时间，要不是工作用的话，肯定会退货了，如果可以完善物流方面的话那就好了。 电脑目前在安装显卡中。
4022	3	挺好的，电脑用过了不错，但是之前没注意，他们家不能开增票，应该在京东自营买的有增票。
4023	3	一直相信京东商城购买的产品，质量可靠、价格实惠质量好。已经第N次购买了，东西使用上了很不错?????，使用起来非常好、绝对是正品。特价促销活动购买的，价格也非常实惠。以后经常回来光顾的。
4024	3	挺好用的   性能不错的机器   就是不知道有没有长性  现在才
4025	3	总体来说还好吧，就是内存比较小，机身很轻，微型主机的那种，其他的还好。客服很热情！
4026	3	英雄联盟中等特效达不到FPS60+&hellip;最多35左右
4027	3	创建日期咋是2017年7月的啊
4028	3	电话就算是个很精彩的
4029	3	固态硬盘坏过，欣慰的是可以换
4030	2	售后喜欢打马虎眼，一个劲忽悠。
4031	3	一分价格一分货
4032	3	一般般出现很多问题
4033	2	物流简直慢的一批 其他还好
4034	2	主机里的东西还会晃动��
4035	2	还行吧，结果很失望&hellip;&hellip;就这样
4036	3	一分钱一分货  图便宜就别指望质量
4037	2	真的太一般了，办公用够了，希望参考。
4038	3	咱电脑小白一枚，不懂的问售后就让我自己百度。666
4039	3	玩游戏卡顿   一卡一卡的  求解答
4040	2	用了几天后。卡的你想砸电脑????
4041	3	哈
4042	3	带不起大游戏
4043	2	哼
4044	2	聊半天,确认好配置清单,结果发错了货,耽误事~
4045	3	DNF运行没问题，LOL的FPS大概30左右无法正常游戏
4046	3	少个螺丝 &hellip;&hellip;
4047	3	3d就很卡。
4048	3	主机还可以，系统装的也太随便了吧，至少装个激活版吧。
4049	2	用了一段时间了，主机没问题，就是显示器换了两次！！闹心！！
4050	2	显卡性能才7千 跑分8w不到 我还是买个显卡换上去吧？？
4051	3	能用吧，毕竟价钱摆着，迷你机箱，迷你主板。缩水显卡。能用。只能说。
4052	2	用了一周了。很多时候会死机！卡顿！简单办公可以做！小游戏也可以玩！
4053	2	主板是微星的，不是商家所说的华硕的，差*，买来给家里老人用的，也算了，从发货到到货时间也挺长&hellip;&hellip;跑分就这样吧&hellip;&hellip;将就用～
4054	3	主机还行吧，就是系统有点问题，到手了，当天我还得自己再重做一下，一分钱一分货吧，办公用足够，质量什么的，用段时间再说吧
4055	3	明明写了开公司发票，死活开个个人发票。
4056	2	这个配置不是我选的配置
4057	3	不能玩吃鸡卡的不要不要的
4058	3	电脑才买来两天就蓝屏，没搞懂
4059	2	换货时间长，退货了
4060	2	玩了2个月就有点卡顿了
4061	3	没有图片好看  一般般吧
4062	3	刷新还是有卡顿不给满分
4063	3	散热风扇声音有点大
4064	3	用的一般，   有时候有点小卡
4065	3	发票不盖发票专用章，以后不敢买了
4066	2	说话配置硬盘线的，最后没有
4067	3	不好，真的不好，毕竟价格就在这。
4068	2	先说带显示器这个价，后又说不带显示器～
4069	2	启动速度还以，就是噪音太大了！
4070	2	到了，，一般般吧。。就这价钱，，慢得要命。。
4071	3	电脑第二天就出现蓝屏，质量有待考究！
4072	3	送的显示屏是坏的，邮过去换了，没给我退邮费
4073	3	机器有点小卡！组装机器就是组装机！
4074	2	风扇噪音大，有些硬件年代有点久远，
4075	3	才到货，点不亮显示器
4076	3	主板有个内存槽有问题，无法再扩内存了
4077	3	电脑运行慢，像乌龟，后悔两个字
4078	3	机子不行，gata5玩不起
4079	3	电脑配置可以，和表示的一样，接口处不是很好
4080	3	有点小问题，已解决。
4081	3	东西一般般吧！中间还出现了点事，客服服态态一星。整体3星
4082	2	说的是升级，结果换上个笔记本用的显卡。。。
4083	2	就很一般。。。。
4084	3	感觉不怎样
4085	2	后面USB接口有问题
4086	3	说是升级成i5其实还不如i3的那个好，感觉上当
4087	3	不怎么好用
4088	3	办公用可以了，不带声卡，还得配个音响。
4089	3	不值得买
4090	3	屏幕裂开了
4091	3	回来用起一天系统提示是盗版系统。直接黑屏
4092	2	感觉这个配置的没有之前的好用， 屏幕也没送了
4093	2	太一般般了
4094	3	刚刚玩着玩着就黑掉了，来不起机了，什么情况，才买一个多月
4095	2	显卡都**的没有 玩鸡毛
4096	3	有一台用两天就开不了机子，建议下次发货记得检查好
4097	3	系统不稳定。一直重复错误页面，用着用着像中毒一样要重启。
4098	3	这主机真不怎么样，玩个2D游戏都卡得要死,唉,上当了!
4099	2	不好用，电脑运行反应迟钝，该卡就卡，没辙了。
4100	3	商家态度好，可是发票错了，而且下单就降价，怎么解决？
4101	3	电脑收到用了几天，感觉还可以，物流速度太慢，客服服务很不好，一会换好几个
4102	3	为什么我刚买完你就降价，能不能返还差价，本来觉得电脑还不错，但这100多元的差价让我很不舒服！
4103	2	Wifi都没一定要连宽带，屏膜显示不行， 一分钱一分货
4104	3	细节决定成败，安装不到位，害我弄了半天，商家也没有赔偿。
4105	2	不行，lol比较卡，而且系统win10还没激活！ 没激活好多功能用不了，跟客服反应，也不回复！
4106	3	CPU使用率有时瞬间到80％以上，过会就降低了，不知道怎么回事问客服还答非所问，
4107	3	发现usb接口不太行，有两个3.0的接口插鼠标不能用，更新驱动也没用
4108	3	目前出现蓝屏现象，刚刚开始试用具体的问题还不知道，耳机有电流声音，cpu温度有点高。
4109	3	机子还可以用，硬盘太小了，存一点相片就满了，要加盘才能用
4110	3	为什么不把显卡装好，让我一个机箱都不知道怎么拆的人装显卡？
4111	3	刚收到时，无法开机好失望啊。经过与售后服务通沟。说可能是电源坏，后来给补发一个电源，换上还行。
4112	2	不好怎么说，已经装过两次系统了还有主板与官方型号不配  本来就是买来收银用的，希望稳定的。感觉不是很满意
4113	2	不愉快，主板US-B连个3.0的都没有，建议配置二主板就写一个H61,不要再写两个了。。。
4114	3	刚买电脑显示都好   但是玩了一个多月   各方面性能减低   刚买玩英雄联盟fps80多    现在玩只有30多
4115	2	一分钱一分货吧，这个主机是真的不行，建议打英雄联盟那些游戏就不要买了。办公可以买。
4116	3	包装还行！I5三代和I3七从**报价看没任何区别，商家这个广告做得不怎么地道.......电脑速度还行，找了个电脑店重新装系统 小哥说除了CPU其他都是假的，我暂且认为是因为没在他店里买而酸溜溜的心理吧
4117	3	嗯东西收到了，但是那个问题还是有的，就是硬盘吗？我不知道怎么开机时间要三十多秒，怎么回事搞不清楚。
4118	3	没有硬盘  上面没有说 还以为 有呢 不过 孩子玩也够了   速度什么的 没的说
4119	3	没法连有线，结果根本不跟我说连光驱都没有，就光给我个无线网卡。呵呵哒，没诚意
4120	3	寄来时外包装损坏，快递员建议不要签收，嫌麻烦就拿回来了，回来后发现下面那个usb口用不了，将就着用了
4121	2	主机开不了机然后寄回去返修，因为是公司给同事买的电脑，期间等了很久都没得电脑用，一直在催，客服态度也可以，就是不能解决实质性问题，只是官方回复而已。体验较差的一次购物
4122	2	电脑一般，里面布线和风扇有摩擦，会有异响，鼠标坏的，给换了一个，另就是下单第二天就降价了，后期和客服沟通无果，只能按订单价了，公司买的，不在乎了！
4123	2	质量一般，去年买的还可以，今年价格便宜，质量也差了。新买的电脑，居然总死机，客服只会说重启。无语了。
4124	3	机箱还可以，物流有点慢，机箱带的硬盘托架没给带，想加块机械硬盘都装不了，联系客服问一下怎么回事，问了三天没人搭理，还好电脑没问题。没有售后的东西不推荐购买
4125	3	CPU是i5，但是性能与i3的差不多.做好的 付款前50名 赠送 价值399的 机械鼠标 我是在 1分钟之内就付款，发来的 就是 样 一个 一般的 机械键鼠
4126	2	看起来还不好，没有想象中固态硬盘的启动速度；想加装一块机械硬盘，竟然没有合适的硬盘支架，自带的ssd是用扎带绑在上面的&hellip;
4127	3	电脑还可以，就是套装里面那个显示器的dvi线应该不是原装，电脑经常无故黑屏一到两秒，打竞技类游戏简直要发狂，排查了好久才确定是显示屏线的问题，今天才又自己去网上买了根线。
4128	3	机箱做工太一般  风扇声音蛮大的会有咕咕咕的声音 估计还要换一个 还是别的地方有问题 后期有问题再叙述吧
4129	3	我要I3 7100的U 还是搞来I5的老掉牙地3代U，反正性能差不多将就用吧，服务倒是挺好的。还有送的折磨好键盘干嘛呢，老是打字输不了中文，还搞的桌面鸡飞狗跳。害得我好一头雾水的改输入法
4130	3	还没用，但是一拆开就发现主板上只装了两颗螺丝，主板都快掉了，后面的那个接线的孔都跑偏了！其他没有什么明显外观问题，使用之后再来评价
4131	3	电脑刚开机没多久就蓝屏了几次，然后无线网卡驱动莫名其妙没了，体验不好，显卡也不给力，就买个看电影的吧，希望可以撑一段时间
4132	3	用了一段时间。总是莫名其妙断网掉线。就是这台电脑。其它的都没事。让人烦不胜烦  不知道是否主板有问题 是其一。 第二 客服之前答应给一颗高清线 到货的时候没有 后来补发来了 让送一个几块钱的转接头都不送。。心里很不痛快 。其它方面还行
4133	2	拉倒吧！这电脑！噪音大！！！！！反应还行～～～搭配的不怎哦样～～～～～谁知道配件是新的还是旧的
4134	2	机器还没使用，包装挺好的，显卡是集成显卡，没有特别说明，有误导消费者的嫌疑。  机箱显卡位置挡板扣开了，问客服是不是有独立显卡没装，说没有，就是集成的。集成你列清单单独列出来干嘛？  列出来我不认识型号，也说的过去，但你把显卡槽扣开。漏个洞是什么意思？满分给物流
4135	2	感觉一般般，不知道是不是主板的问题，感觉发挥不了cpu的能力，这cpu用着都比不上我14年买的4430，还有一个问题就是主机我放桌子上，有点震，噪音大，用手压着就不响，桌子看也没什么不平，不知道是不是机箱安装哪里不稳。
4136	2	性价比还是可以咯，2000来块钱搞定全部，但是对店家的套路真的很反感，不诚实，所谓i3升级i5就是幌子，降价也是幌子，因为配置也跟着降了，降成一个第二代的i5，二代i5都是至少5年6年前的产品了，还不如新的i3。 电脑整体操作还是能满足的，日常办公ps美工还是能胜任，但是可能是因为二代处理器太老的原因集成的显卡非常差，看个电影都会卡的那种，拖动屏幕会带着幻影的。
4137	3	CPU 升级I5 的形象挺好，但是 懂行的都知道 2代的就算了，办公够用 散热器，不玩游戏，没要求 主板  B75比较良心，牌子就算了 显卡：你至少标明集成核显啊 内存：8G市价一条200左右，在这+1条要 300，放弃 硬盘240g也是良心，但愿不是二手货 电源：330w 不玩游戏，够用 总结：打着活动的幌子出售一分钱一分货的机器，买家不亏也没优惠，比较是营销手段嘛 吐槽：活动作假，至少送个小音箱啥的才对得起活动，是吧？ 鼠标键盘鼠标垫本来就是本行的标配
4138	2	不咋地，显卡很差
4139	3	态度不好 特别售后态度
4140	2	物流很慢，性能一般
4141	2	物流太慢 物流太慢 物流太慢 5天。赠品与描述不符。
4142	2	嗡嗡机，嗡嗡叫，不能花钱买个大烦恼，咨询信息:就这样，散热好就等于嗡嗡叫
4143	3	没送固定用的螺丝   很不爽这次购物
4144	3	显卡是真的啦鸡，赚太多了
4145	2	劝即将购买电脑的朋友花同样的钱，花时间自己去电脑城组装，电脑到了以后鲁大师评分9W打lol卡的飞起。电脑自带系统漏洞病毒一大堆，后面下了360杀毒电脑从此就打不开了，还要自己出去装系统。
4146	3	超级无敌烂的售后，声音大的跟拖拉机一样
4147	2	今天收到，装好打开电脑声音太大了
4148	3	老板太小气，本来还想再买一台，一点优惠都没有
4149	2	服务太差了，装的系统搞得我要从装
4150	2	才用了三天，风扇声音特别大
4151	3	咋没红颜色呢？这个叫我无语啊！
4152	3	预装的win10很烂，偶尔死机，部分功能有问题
4153	3	重启键超坑   摁了之后东西全无   送的鼠标跟音响线特短
4154	2	差评，散热跟电源都是垃圾，买过来我都要换
4155	3	主机太小
4156	3	快递太**了！
4157	3	物流太慢了&hellip;&hellip;我同时在其他网上买的东西，比京东快一天半 我这是给客户卖的东西客户天天催我 差评
4158	2	售后服务，一直都不理人，买的时候跟你推销都来不及，买了之后，你求售后
4159	2	刚买回来就降价，买的时候已经是活动价了，没想到买了回来再降价！！真的是无语！！
4160	3	主机硬盘太小   装几个游戏就满了   还得自己加装太麻烦了
4161	2	第一次在京东买东西，商家服务太差劲，快点发货一个星期都没到，非常不满意！！！！
4162	2	M.D买了不到一个月降价300，打英雄联盟卡的**必须特效全部关，而且还的调到最_低，太失望了
4163	3	选的机箱等了7天无货，给我换了别的机箱，也还凑合用了，实在没有时间等了。
4164	2	为什么是两星呢，是因为我找客服要发票从来没回过我，一直都是自动回复，后来拖了快一周了，找京东客服才帮我要到的，态度有问题，第三方商家需要严厉监管
4165	2	第一次在京东遇上这么不愉快购物体验，装的win10系统菜单一个也打不开'，就是任务管理器也打不开，一肚子气
4166	3	1859价格的配置玩不了CF等大型游戏，非常卡！亲身体验。赠送的显示器声音很大，主机倒是噪声很小！
4167	2	刚到的时候用来玩英雄联盟一直链接不上，害我连挂了几次逃跑，被封号了一星期，无语
4168	3	机器硬件没问题 用了两天可以  就是风扇声音太大了 这配的风扇太差了
4169	2	配置我当时页面上看的时候是一样，下单的时候就莫名其妙变了。我懒得跟客服沟通了。凑合用吧。你们买的时候注意吧
4170	3	速度是很快，但是我收到的这款主机怎么开机运行以后声音很大？吵死了，严重影响使用，大家有没有这样的问题？
4171	3	给老人配的，系统没给做好，无法链接网络，得自己重新做，一下又的多等一周再去了才能弄，很麻烦
4172	2	主机后面的主板外壳与主板并没有组装好，所有的卡位都跳出，这样的安装太不上心了。只能自己重新松螺丝，重新装好。
4173	2	品质保障物流神速就选京东，第三方就不行了，送的键盘都是坏的，因工作需要着急用，沟通隔了好几天都没发货，耽误我们好几天时间
4174	2	2000块买这么个垃圾电脑，玩英雄联盟都玩不了，卡得要屎，买过最垃圾的电脑
4175	2	我这cpu评分就三万多是缩水的吗，还是因为是xp的，总评分五万多，觉得很垃圾，还卡的很。觉得不值，估计还不如拿i3的。
4176	2	买回来一查配置，处理器和主板与宣传的降了一个档次，问客服，说是618活动刚改的，我也是醉了，另外风扇声音有点大，一阵一阵的，总之这次购物感觉一般般，看在客服还是比较有耐心的，勉强给个2星吧
4177	3	一般吧，FPS跳的还挺厉害，双十一前几天买的，双十一当天降了200，显卡配置换了1050，当时看到降价，问了下售后，售后说可以保价，我也就没当回事，过几天又找售后，售后刚开始说这个机子不保价，然后我截图第一天与售后的对话，又说可以保价，登记了退款账号，等了大概四天，中间还催了一次，说财务的程序要3到5天，第四天再去催保价款，然后马上就打到账户，只退了89。显卡买亏了，现在上班都没时间退了
4178	3	这次购物闹心，主板换2次，显卡2次，最后可能是不兼容整机返，算了整机有点不放心。就这么用着吧，客服买的时候回的好快，买到后回的好慢慢
4179	2	购买的时候客服说的是有dvi接口，来了只有vga接口，可见主板是有多老，我问客服为何一开始不解释清楚，人家说让我去买个显卡，我。。。。送的键盘，换了2次都有问题，最后一次终于没有问题，可以用了。购物不愉快
4180	3	买的是套餐二，帮别人买的，可是买回来，发现电脑配置是都是老款，而且跑分还很低，比我之前半年买的电脑，差多了。之前也是在这家买的。比我之前。跑分低两万呢。
4181	3	这主机的运行速度还没有我两年前更便宜买的(i5 4590，4G内存)处理器快，要求装的win7系统是试用版，还是一堆垃圾软件的，又不是正版，有必要吗？说真的，买了挺后悔，不过，我已经重装了系统，估计商家也不肯退货的，所以，将就就用了
4182	3	买的时候还是*主板是最便宜的网吧或者电商特供板，除*网都搜不到的差评小板，电源额定400瓦，峰值500瓦，装独显和机械硬盘需要考虑更换更大功率电源，128g的tlc颗粒的固态，感觉心塞塞的！
4183	3	硬盘持续异响，客服说都是正常现象。厉害了，松动都不算毛病吗？要不说投诉都不搭理你，中评，不开心的体验。机器运行还是可以的，暂时没别的毛病
4184	3	机器还可以。被忽悠了安装了风扇。这声音我去了，太大了不是一般的大。还有电源。这个电源真的好垃圾。建议买的人更换。电源声音也不是一般的小。哎。
4185	3	不满意，装的盗版的系统软件，开机黑屏，网络不断掉线，系统还不断跳出提示是&ldquo;盗版&rdquo;，另外，什么常用的软件都没有，连输入法，office都没。累死个人
4186	3	117667就跑了这么多，真郁闷！今天刚拿到货。还没有以前的机子玩起来高！
4187	2	主机的其它性能都很好，只是它装的显卡是A卡。以前我从没用过A卡，现在才知道A卡是游戏黑洞，玩游戏会黑屏，根本无解。到网上一查，才知道A卡游戏黑屏由来已久。不是商家问题。
4188	2	上当了，i3 7100与i5 3470从Cpu性能上相差不多，但后者是22制程，7100是14n，还有B75主板是很古老产品了，不支持DDR4，4G DDR4换8G DDR3虽然不吃亏，但实际失去了升级可能，这款升级套餐二非常不划算，不如套餐一加4G内存，老板很不诚实，套餐二没标是DDR3内存。
4189	3	蓝瘦，香菇。 本来要拍配置②，结果忘了备注。默认发配置一， 跟店家沟通换主机，结果邮费自付，一百多，买来打游戏的，  这个是集成显卡，鲁大师跑分才八万多，测的最高一次才十万多点儿&hellip;&hellip;
