2888	3	感觉挺好用的，但是不适合出差外带。因为有些重，适合放在办公桌或者家里使用。
2889	3	轻薄美观，但性价比不高，只适合办公，打游戏完全不得行，卡的很。问题是没有找到保修卡。
2890	3	还行吧，只能说看个电影打打字还行，其他的白搭，价格贵了点，样子倒是好看
2891	3	物流够快。电脑还不错，常规速度吧。就是裸机，啥也没有，最起码带个电脑包吧，明天出门了，正在想如何携带。
2892	3	实话实说，真的很慢很卡，用着用着就重启了，不知道什么情况，外观确实很漂亮，看着蛮欢喜的，就是用着不咋滴?
2893	3	好看是真的，都特别好，但是很卡，不是很懂电脑所以不知道该如何改善一下，购买同款的大神望留言指导一下
2894	3	拿到后用了一下，开机速度不是很快，电池如果把亮度调暗一点，大概能坚持3个消失左右，另外，屏幕分辨率较高，而且是独立显卡。以这个价格，还是很划算的。
2895	3	电脑外观首先不是特别好看，主要是颜色，然后电脑比较慢我觉得，电脑会自动更新配置，声音，画质都是可以的，然后客服也很耐心及时的回复问题，总体感觉一般。
2896	3	东西还不错，加了4g内存，重新安装了win7，基本可以不用加固态了，毕竟还是wd的黑盘。 但是delete键竟然是歪的，虽然可以用，但是毕竟是个新电脑。然而咨询客服，直接丢给我售后的电话，第一次给三星！！！
2897	3	运行速度：有点卡，老是要你更新
2898	2	外形外观：窄边，漂亮，就是容易掉网
2899	3	用一段时间再来追评吧！
2900	2	~竞价包年推广13713813466刘懂
2901	3	这个配置@这个价格算是勉强
2902	2	睡眠模式唤醒后黑屏
2903	3	还行吧，有一点卡
2904	3	运行速度：比较慢哈。
2905	3	轻薄程度：还可以吧
2906	3	待使用后再评价
2907	2	就是好用，真的很烂
2908	3	运行速度：还是有些卡
2909	2	运行速度：真的卡
2910	3	还未使用,用后再来补充
2911	2	联想现在已经是明日黄花了
2912	2	经常要系统更新，越来越卡
2913	2	产品真不行，售后更渣子，京东解决的还是不错
2914	2	这电脑买来第一天用着很卡
2915	3	散热性能：差 运行速度：一般 轻薄程度：一般 外形外观：可以 屏幕效果：一般
2916	3	电脑还可以，三颗星是因为才买几天就降了*
2917	3	电脑各种不适应，也许因为我是小白的缘故吧
2918	3	满足一般家用，8G内存才凑合着用
2919	3	给公司买的、还没使用，应该还行吧
2920	3	开机慢到世界静止
2921	3	谁能告诉我电脑可以如何变快，不卡顿
2922	3	用了一小段时间,开始卡，一般
2923	3	买得时候就分区了，而且就分了两个区
2924	3	早知道多花点钱买个真4核，跑python都慢.....
2925	3	开机慢，其他先适用再追评
2926	3	帮同事买的，开机加载的东西太多，运行慢
2927	2	平时用用处理文件看看电影啥的，够用了。
2928	3	还行吧 这个价位的笔记本 卡的不行
2929	3	自带的win10系统**
2930	3	卡的一批
2931	3	被拆封过
2932	3	的确很卡。刚开始用已经死机了一次。,,,,,,,,,,,,,,,,,,,,,,,,,,
2933	2	卡卡
2934	3	一般吧
2935	3	一般般吧。
2936	2	卡卡卡
2937	2	起动像蜗牛
2938	3	笔记本太卡
2939	2	运行速度：慢
2940	3	还可以吧，我是菜鸟，先试试再说吧
2941	3	屏幕差了点&hellip;&hellip;还有发热挺厉害的&hellip;&hellip;
2942	2	运行速度：一般 屏幕效果：一般 轻薄程度：还行 外形外观：不错 散热性能：还行 其他特色：玩游戏是别想了
2943	3	没联网激活还好，联网激活以后还是有小问题。
2944	2	卡。
2945	2	产品质量挺好，京东售后体系越来越差，推诿扯皮现象严重！
2946	3	买了一个月动不动死机，用office和wps都卡&hellip;&hellip;这咋办公
2947	2	外观一般般吧，精密度待提升，糸统不好用&hellip;&hellip;
2948	2	非常卡，开机5分钟才正常使用
2949	2	外观不错 打开使用后运行期间有黑屏现象 打开表格还无响应
2950	3	刚开机用了差不多5分钟，但是后面就变成了二十多秒，写作业用着还行，后面用一段时间再来评价吧
2951	2	运行速度超慢，而且连接M７２５６WHF一体机，一直报错．联想售后让恢复系统试一下．想支持国货，但国货也得争气呀．
2952	2	运行速度堪比家里用了六七年的三代cpu台式机，音响效果仿佛在人来人往菜市场开拖**。
2953	2	运行速度：家里原来的机器时间太久了，准备买一个笔记本电脑作为老人机。在网上看到这款，觉得好便宜，还是thinkpad的。原本心里还很高兴。觉得这么少的钱买到。可是回来一来，开机超级慢，运行过程也很慢。慢到什么程度呢，右键选择个选项的圈圈都转半天。 屏幕效果：还行吧，比较不错。 外形外观：外观还算比较漂亮。 轻薄程度：整体外观还是不错，屏幕也比较大。但是就是运行太慢，你都会怀疑它是不是一个新买的电脑。
2954	2	感觉有点卡，散热不行，特别烫，充电器也会特别烫。外观挺好看的
2955	2	除了外观体验很一般，还是喜欢win7系统，性能还可以，操作不爽，只能给两星
2956	2	嗯嗯嗯嗯嗯嗯嗯嗯嗯，就是win7安装不上。去联想电脑实体店售后说，这个配置的电脑安装win7不上。说驱动程序已经没有了。哎呀呀。
2957	3	电脑一般吧   还是要装硬盘和内存   作为办公用学习还可以   打大型游戏就要装
2958	2	全**是坑。
2959	3	这个配置预装win10，运行还是比较吃力，如果自己没有升级硬件，还是建议装成win7。使用一个月win10已卡成蜗牛，现已改装win7。用段时间再评价。
2960	2	电脑到了，赠送的包未到，难到要我收两回吗，商品待测后再追评，还有谁可以告诉我这款笔记本可以加那种固态硬盘?
2961	3	还行吧，不是多好，也不是太差那种，
2962	3	延迟了一个多月才发的货。 东西一般。
2963	3	京东服务还是很好的就是价格幅度太大保价时间太短了！～
2964	3	反应速度没有那么快哦
2965	3	运行速度：卡，开机没有三五分钟想都不要想
2966	3	电脑慢，对不起这个价格。
2967	3	有点卡，反正也就这价位了
2968	3	买完就大降价，电脑反应慢
2969	3	运行的速度不是很理想！
2970	2	动不动自动断网是什么鬼？
2971	3	有点卡还会黑屏不是很好用
2972	2	用了一个月就卡顿的要死。
2973	3	一般吧，不如同等价位别的品牌
2974	3	为何不送个鼠标？
2975	3	开机慢慢慢慢慢慢慢
2976	2	没鼠标，也没讲清楚
2977	2	收到货不是标准标配，缺少配件???
2978	3	才买几天就降了*
2979	3	开机有点慢，有点卡
2980	3	机子激活有点麻烦
2981	3	为啥系统没有@啊？什么情况？
2982	2	运行速度不咋的
2983	3	慢，一分钱一分货。
2984	3	散热差些，基本够用
2985	3	不是很好，还算可以
2986	3	能用.，就是有点慢
2987	2	没什么性价比，被荣耀完爆
2988	3	性能一般反应慢，体统不是正版
2989	3	为什么总有卡顿，无响应。
2990	2	凑合用吧，不是一般的卡！
2991	3	第二天系统就崩了一次
2992	3	开机慢,送的包包也好丑
2993	2	感觉速度越来越慢了啊，感觉不太值
2994	3	电脑运行起来感觉比较慢
2995	3	包是坏的，电脑应该还好
2996	3	办公还是有点慢，勉强使用吧。
2997	3	新机器开机就关不了了，不要跑售后！
2998	2	用着有点慢，不知道为什么，不知道改找谁
2999	3	电脑有点慢。有点卡
3000	3	以后不买联想了
3001	3	这个运行就一般，没多让我欢喜
3002	2	外形外观：品控一般，转轴两边缝隙大小不一样&hellip;&hellip;
3003	3	挺好的，不过建议买i5的处理器，贵点贵点吧
3004	2	啥都没有就一个裸机，佩服佩服
3005	3	开关机比较慢，屏幕分辨率较差
3006	3	换了一台，有点慢
3007	3	有点慢，有点卡。其它还好。
3008	3	电脑的反应速度慢了些，不太理想
3009	3	硬盘声音怎么这么大？别的还好！
3010	3	这个字母J键盘什么鬼？才买来两天
3011	2	买回不到1个月就黑屏，服了
3012	3	开机时间过长，速度慢，不理想
3013	3	有点慢，只能说，再看看先再来。
3014	3	有问题，第三次开机输入密码后黑屏
3015	3	运行速度：其他都还好，就这个运行速度。唉，第一次开机就差点被我砸了
3016	3	买了10天，2台机器共降了*元，不给保价
3017	3	整理来说，性价比算高的，开机时有些慢
3018	3	电脑性能一般,散热还行,速度有点慢
3019	3	随机预装的win10不能@，不知是不是预装的不是正版，店家客服也没能解决
3020	3	散热不是很好，机子显得很古板，不像新款
3021	3	连接转轴处线外露，开合过程中线会拉到！
3022	3	总体感受 win10系统用起来满，懒得退换了
3023	2	运行速度：挺慢的，买了给公司内勤用的，一个月的时候，还开不了机，去重装系统的。
3024	3	开机时间长 反应速度慢 总体不满意
3025	2	外观看着还行就是开机特别慢同事说有可能是串的?
3026	3	用了不到一个月，突然降价700大洋，还没法保价&hellip;
3027	3	一般般吧，价格偏高了。
3028	3	散热性能：散热很一般 运行速度：运行大文件有些卡 屏幕效果：一般 轻薄程度：一般
3029	3	开机速度慢，系统慢，
3030	3	有些卡，没想象的好，
3031	3	不是很满意！产品不错！可是现在降价太多了！差了小七百块钱
3032	2	不太喜欢这个型号, 连网了. 怕麻烦了.
3033	3	分辨率太低，其他还好。感觉有点大了，呵呵
3034	3	偶尔办公用，没报高期望，但此本确实挺慢，不推荐
3035	3	慢
3036	2	运行速度慢！不满意！
3037	2	开机慢的一批
3038	3	运行速度：电子表格多开几个就反应很慢 散热性能：用了几天散热一般 其他外形轻薄还可以
3039	3	不好用
3040	2	开机慢
3041	3	没有发鼠标！！！
3042	3	有点卡，颜值高
3043	3	鼠标都没一个
3044	3	速度有点慢
3045	3	不是很满意
3046	2	卡得无法
3047	3	有点慢
3048	3	有点卡
3049	3	反应慢啊
3050	2	有点卡
3051	2	慢的要死
3052	3	容易卡
3053	2	读速还是慢
3054	2	巨卡巨慢
3055	2	系统有点慢
3056	2	卡，开机慢
3057	3	直接卡死
3058	3	运行速度：慢到爆，网速正常的情况下打开个一个页面没有一分钟以上根本打不开，其它的都挺好
3059	2	这台电脑经常卡顿，经常死在那里不动了，不建议购买
3060	3	上当了，当时买是秒杀的，秒杀完了一看还是这个价格。。。。。
3061	2	外形好看，但是系统太慢了，简直无法使用！
3062	2	贪便宜的下场，就是忍受拉的一笔的电脑 。后悔了
3063	3	才买来两天的机子，第二次就打不开了，拿去售后门店，说是可能主板坏了，唉，好心累，希望换的新机质量好
3064	3	觉得不太好用，容易卡机，而且触屏感觉不太好
3065	3	收到货后用了2天就黑屏了，屏幕只显示鼠标箭头在动，其他的都ok
3066	2	质量不太好，不如e430
3067	3	电脑用着不错 就是刚买两周就降价*感觉价格浮动太大了
3068	3	不管是运行 还是点击软件反应 都慢了一大截...什么情况
3069	2	10号下单*元，12号就*，这速度扛扛      
3070	3	这开机速度，我也是醉了，两个小时了还在显示请稍后。
3071	3	价格变化大，速度慢，加装了固态和内存才能用
3072	3	买来使用时发现屏幕有点漏光，已经做了退货处理，客服态度还不错
3073	3	价格便宜，就是太重，发热量有点大了，这价位也就这样了
3074	2	卡，内存小
3075	2	不知道为啥，并不是很快，偶尔会卡，着急用，没法退了
3076	3	还可以吧 不怎么流畅 太勉强了 综合性价比不高
3077	3	系统无法激活
3078	2	京东已象摆地摊的模样了，短时间价格忽上忽下折腾不已，是在焦虑啥吧，放出的信号???
3079	3	才买来，开机后是黑屏
3080	3	看着挺好，用起来很慢。不知道是软件问题还是什么。
3081	3	电脑不是用的很习惯，缓冲时间有点长了不知道那么调得到
3082	3	实际用起来比较慢，新机器竟然有点卡，同样这个价位的小米就完全没有任何问题，唉，后悔了
3083	3	可能是系统不熟悉，用起卡，速度慢，不是很满意
3084	2	开机慢，用不到多久就黑屏，充电时冲得进时冲得进电
3085	3	用了三年的t系列，再摸摸这个，还是有点差距&hellip;&hellip;
3086	3	感觉一般般 反应不是多么快 办个工 做个资料行
3087	3	挺贵的，性能也就一般化吧！只是办公用，别的都不敢下！
3088	3	价格实惠 但运行速度较慢 我觉得一般 不推荐购买
3089	3	希望不要有问题  第一台现在USB接口有问题了 才一个多月
3090	2	e480启用独立显卡几分钟后就蓝屏，，网上有这种情况的挺多，要买的慎重了！
3091	3	这个配置，7带cpu，办公够用，为什么不搞个8代，7代价格还这么贵，说不过去。
3092	3	公司办公用的，买回来才发现这款电脑分辨率居然不是1080P的。实在有点无法忍受！
3093	3	机器配500G机械硬盘，速度没有想象的好，自己改成了固态硬盘
3094	3	重量并不轻，可能是机械硬盘的缘故；右手托处长时间使用热度明显；屏幕没有传统14寸本感觉的大，下边太宽，不好看。就是便宜而已。此外，4G内存明显不够用，还得再加装。 外形外观：外观确实不错，不像传统ThinkPad的那种死板配色
3095	2	电脑回来机械硬盘坏的 因为急用就没退 去找售后修的 整的心里挺不得劲
3096	2	真的是动不动就卡，打开个excel表格都要缓冲一下，就连保存个文档也要卡一下，
3097	2	不行，换货后，散热还是不行。WiFi也慢的#。联想管家也卡。唉，联想主板。我准备拿到售后看看。
3098	3	笔记本是比较便宜！但是有一个大缝子，不知道是不是质量问题，希望能给解决！！！
3099	3	装win7后，驱动兼容不是太好，又恢复为win10，配置不低，不知道为什么开机确实慢。
3100	3	电脑只能说一般，刚用没几天就卡，触摸鼠标，也有点不灵敏
3101	2	好慢，用的第3天，开机10分钟了还没打开，打字2秒后才出现字，
3102	2	运行速度还是比较慢，屏幕边框也跟有点宽，跟宣传的有点差距。
3103	3	机器是正品！外观轻巧！缺点不是SSD硬盘，系统慢！I3的性能难以发挥！
3104	2	没办法，在这一周里，他黑屏了两次，续航也没有五到八个小时，省钱嘛，认了
3105	2	就一个电脑，没有电脑包，没有键盘垫子，没有鼠标，有点失望
3106	2	赶时间上网买出差用，送货很快，但是系统运行真心慢，有点后悔上网买了。
3107	3	拿到手一开机，太慢了，马上花几百块换了个固态硬盘，速度快多了
3108	3	此机性能不行，感觉就是一种高频低能产品，如果是配个8G的还是可以
3109	2	刚收到货，试用一下内存就75   ，80的，开玩笑嘛，这还怎么玩，果断退了
3110	3	一般般，开机比我以前两千多买的联想还慢，但续航时间还是足够长的
3111	3	卖给长辈用的，最低配版，现在看还行吧，就是感觉有点慢，不知是不是是电脑的原因吗？
3112	3	网上评价说反应慢，心里做好了准备，毕竟价钱在那放着，可是收到的时候还是不能接受，开机就要快1分钟了，比买的10年的老机子还要慢了，只能说一分价钱一分货
3113	3	手感挺好的，但是卡卡的不知道为什么，新电脑不应该吧，电脑~还闪退。
3114	3	一点也不流畅啊，好卡。，便宜果然没好货。，我该怎么办呐？
3115	3	怎么说呢，一个优酷占用内存的百分之八十，还不能切换清晰度??
3116	3	送货很快，质量没有大问题，只是散热扇那为啥总是转几圈就出现吱吱几声，不仔细听听不出来。京东买这么多电子设备第一次遇到有小毛病的。如果实体买的就退换了，网上太麻烦就算了
3117	3	双11下的单，一直显示采购中，等了半个月，开机速度有点慢，体现不出该配置，win10系统带免费的office。
3118	3	东西到了，但是用着没有想象中那么快。开机虽然是15秒，但是还是需要再缓一下才可以。物流倒是很快
3119	3	刚开始用，感觉到有点卡，右下角处风扇声音不平稳，有点异响，不知道用久了会怎样。
3120	3	这电脑是给我姐买的，安装使用了，听她说反应有点慢有点卡，价格双十一倒是便宜了一千多块。还是比较划算的，但速度有点慢。
3121	2	卡，慢，反应迟钝。。。
3122	3	有些重 ，开机反映慢，只可惜包装盒扔了，要不就退货了，安装了好多没用的软件，卸载后稍微好些了
3123	3	刚收到，感觉有点厚，运行一小时有点热。联系客服，直接给链接网址，自己处理。不是很好。
3124	2	运行速度：效果并不好，新机器就比较卡，偶尔还会出现画面掉帧，启动office办公软件卡死的现象 屏幕效果：一般般，14寸屏幕技术已经成熟多年，显影效果没什么出彩的 轻薄程度：比老版的think pad薄的多，但是和其他系列轻薄本比起来还是有差距 作为一个3k多的笔记本来说，办公场合适合做文案，但是设计软件，绘图软件，渲染软件等并不适合，且文案处理工作作为新机器来说也不算得心应手，因为 散热性能：实在是太渣了，如果下面不放隔热板（笔记本外置散热板）温度直接爆炸 给三星纯粹就是图便宜的一个评价，作为一个坐在办公室里的游戏玩儿家来说花这个价钱买这么个配置有些不够看，比起隔壁hp，机械革命等游戏本厂商出的办公轻薄本比起来性价比高下立判
3125	2	电脑外观与键盘手感都不错：可能是里面硬件搭配的问题开机与处理文件反应慢：联想自己装了自己的软件也不好用
3126	3	特意用了一个月再来评价，真的慢，看了评论一大群人和我感觉一样，而且还有电流声，唉，只想买个可靠本本用于工作。外观设计算是可以，但是没理由这么慢的
3127	3	简单使用了下     速度一般   屏幕显示清晰度及色彩一般       还没空装其他软件    送的电脑包材质不好
3128	3	刚买回来一直没时间细看，没有外放声音，新机器是不是都是这样的啊？开机的时间也比较长，找客服要了售后电话，准备去看看是咋回事。
3129	2	给同事买的。可能是硬盘的原因开机速度还是太慢。望厂家能优化。开始还以为是民族企业，渐生好感，现阿庆的各种场合各种表态后有有点累觉不爱了
3130	2	慢 这个真的是一分钱一分货货 学生党不要买 当上网本好了。觉得对不起这个价 开两个软件就80%以上的占用内存
3131	3	我收到的电脑一点电都没有，是不是新的都这样，视频也一般般，现还不知道卡不卡，快不快，等两天再追加
3132	2	到手第一天第一次重启就花屏，加了m.2固态重装了系统开机速度还要30秒！总体感觉不是很好
3133	3	买的时候没有注意500g硬盘是机械硬盘不是固态盘 只怪自己没注意 反应有点迟钝 和同价位的华为荣耀没得比 办公用还行吧 用一段时间再来评价 物流速度和快递小哥态度很赞
3134	3	开机时会卡黑屏一会，鼠标有时会卡，应用打开慢有时还打不开，放视频时也有点卡，像素一般
3135	2	配送速度没话说，但是电脑用了这么多天，卡顿严重，但是作为日常办公而且价格也不高还能忍忍，但是有时候会无缘无故死机就比较麻烦，不知道是系统问题还是硬件问题，还要去找售后&hellip;&hellip;
3136	3	显示可以，typec 接口，启动有点慢，运行软件感觉也有点慢，还好是老人机
3137	3	包裹包装完整无异常，机器可以正常安装系统正常运行，但是屏幕有一个坏点（黑点），位于右下角距离右边底边大约4厘米的位置，心中不爽，本想换货，可是急着用而且收货地点有点偏僻不好寄快递，算了，运气不好吧。
3138	2	运行慢，很慢。另外重启电脑后，系统会自动@，就没法退换货的，要注意。外观还可以。要换成win7的系统，再加个ssd应该会好很多。
3139	2	电脑已经收到了，用了一段时间，感觉一般，速度没有想象的那样快，只是办公来用，反应不是很快，有时候还会卡住不动，。。。。
3140	3	速度很慢，低配，样子还行，我老公着急买，不然等等，还能降价，性价比一般吧，10系统估计很多人用不惯，?扔了，不退了，京东送货一如既往，很热情很速度。
3141	2	只能说将就用，笔记本显示的清晰度和色彩对比，都不能和台式机相比，只不过这内存太小，只不过开个同花顺和360游览器，就快满了。
3142	3	说实话，电脑还是挺好看的，不知道是不是配置太低了，超级卡，软件用的时候还好，打开要好久，要知道，我现在还没占多少内存。
3143	3	买回来不到一个月，开机就卡了，而且我平常不打游戏，不追剧，之前刷课还挺好的，但是我就几天没用，它就显示要优化，结果优化失败?，开机就用了一分多钟。
3144	3	东西不错，水冷有声音很大，机箱太薄不结实
3145	3	商品很满意出了点问题！使用预装系统qq被盗克
3146	3	还可以玩
3147	3	快递满死啦
3148	3	其它还好 ，就是玩个吃鸡主机烫得跟要爆炸一样哎
3149	3	显卡不错，就是磁盘只有100多g，下几个游戏就没了
3150	3	给的电源线接头太松，碰下电脑就跳电源。总得来说还不错。
3151	3	还好吧，！？！！！！！
3152	3	性能都还可以，主板小，图片是可以亮灯，可拿到却不是，很厉害
3153	3	运行速度：开机挺快，运行速度还可以，就是游戏内的网页打不开，不知道是不是系统跟游戏不兼容，外面网页可以打开。 游戏效果：逆战 FPS才79，感觉有点低，1660的显卡这么菜的吗？4000的主机感觉不值这个价。勉强给个三星。 外形外观：外观挺漂亮的 安装难度：安装简单，跟客服沟通也很耐心的解决了。
3154	3	本来想给好评的  但是真的有很多问题
3155	3	主机箱前面有条裂缝，2cm左右，其他都可以，装好了就懒得换了，总体来说还好
3156	3	电脑回来用了2天，挺好的，送的win10正版系统也很好，物有所值，说下缺点：圆通一生黑，一生黑！！！！！！！！！！！！！！！！！
3157	3	用着还行，不卡，开机要7秒，评分低了一些，就是我要的配置1给发成配置2了换货又要好几天，将就用了?希望工包质量好点
3158	3	东西今天刚收到，初步体验很好，没发现什么问题。但是机箱收到的时候有损坏，机箱底部四个支撑坏了一个。
3159	3	还可以吧，现在来看性价比还很合适，配置都跟描述的一样，但是机箱有问题，侧板盖不上，也懒得换了。而且感觉包装的不怎么用心，到货的的时候箱子直晃荡！
3160	3	电脑刚买回来速度还可以，开机25秒，用了半个多月了出现几次死机情况
3161	3	机箱总体来说还可以！开机4-6秒！跑分23w   lol基本稳定在250左右的F！客服不给力！回复消息好慢！物流也慢！机箱目前来说还算满意！用几天以后再来追评
3162	3	机器本身不错，但用了一个周后发现有呜呜呜的异响，声音很大，应该是风扇没固定好或者其他原因，搞不懂
3163	3	主机还是不错的，刚买回来跑分26W，客服沫沫不错。 说好的发货前装机测试，主机回到我加装的1T硬盘不显示，客服在线指导了好久，自己也弄不好，无奈只能上门维修，现在终于弄好了，又看到价格下跌了几百。心里真不是滋味。 勉强好评
3164	3	昨天下午到货，首先要说包装的很好很细致。电脑装好用起来还行，反应，速度各方面都还好。但是晚上手动重启的时候 蓝屏了一次，不知道为啥，虽然只出现了一次，但是还是感觉很不爽。
3165	3	还行吧，不过为什么360里面显示会出现AMD服务，感觉是二手的，明明是英特尔的CPU，显卡也是NVIDIA，搞不懂，还好运行速度还可以。反正是用来工作的电脑，凑合用了，如果是放家里的电脑，肯定还是要自己组装。
3166	3	客观评价：缺点，系统预装了360流氓全家桶，差评。开机第一件事就是把360全卸载了，可能与360合作了。电源及里面的线材一般般感觉不结实。                   优点，性价比高实惠     总的来说，配件都是新的可放的购买，电脑很流畅，性价比高值得你入手.
