1456	3	以前就说过京东的服务不太好，为了购物服务更好，为了购物方便，自己特意买了PLUS会员，就算是直营店谁知还是一样的垃圾~原来显示是第二天送到的，实际没有，虽然经咨询，赠送了京豆作为补偿，但总归是服务没在承诺内做好，如果不问，可能就不理了，还是买来的会员哦，然后还要提一事：在京东直营买了台荣耀手机，一个月没到屏无故有黑线，在我的权益内说是可以以换代修的，但实际没有，说是要订单售后时提出申请能显示才有，这不是让京东自己说了算吗？如果这样，你就不要有以换代修的权益给我~手机修好了，说是原贴膜给我弄坏了（是内屏坏），给我20元京券补偿，显示是全品类券，但实际这20元京券还是要某些才可以用，我X,如果京东直营店都用不了，这也叫全品类券？反馈就说是这样，这个用不了叫我购另外的用，恼火不？我在维修结果那里反馈不接受，到现在问题还是没有解决，一直在那挂着~看罢，京东就是这德性~
1457	2	电脑本身可以，有三个缺点，一，机器的无线网卡非常差，我路由器在客厅，电脑在书房，完全连不上wifi，而我手机，ipad,笔记本在书房连wifi都没任何问题，如果你放电脑的地方没有网线，请慎重考虑。二，商品描述中，写的内含一个3.5硬盘位，两个2.5硬盘位，一个M.2固态硬盘位，打开机箱发现，只有一个3.5硬盘位，一个m.2固态硬盘位，根本没有2.5硬盘位，商品与描述不符。三，附带的显示器，看字久了眼睛疼，建议不买附带显示器的套餐。
1458	3	电脑与显示器的套装，给人的感觉还不如自己组装的好用，显示器精简得不行，只有一个VGA接口，显示效果也非常不好，我四年前买的AOC的IPS屏显示器，至今效果扛扛的，清晰度与可视角度，明度对比度也不是一般的好。这个DELL的显示器，基本上是亮度有点发白，对比度差得不行，眼睛看着都痛。主机更是不说，说是只能装WIN10系统，机箱轻得惊人。系统恢复也无法用，打DELL电话基本就是忙的状态，三次没有一次有人接听。从DELL网站下一个win10 ,装上后将我的机械硬盘装了，固态硬盘却找不到。后来自己想法终于装了一个WIN10 PRO版的，还算能用。一切还得靠自己。希望硬件质量能过关让我用上四五年。
1459	3	电脑用了几次了，感觉还可以。只是购买时以为是无线鼠标无线键盘，结果收到的是有线的，而且直观感觉质量有点次，轻飘飘没质感，配不上我这个价格。固体硬盘启动很快，windows10还没用熟。配带的正版杀毒也暂时不知道如何启用或者如何退出，感觉非常陌生（本人不是菜鸟级用户）。电脑似乎带了（或者自动安装了）很多不同品牌的杀****，还有很多我个人不需要的预装APP。暂时找不到恢复盘，也没有任何安装文件。以后若需要重装维护暂时不知道要如何进行。没有任何驱动程序备份，重装时要如何安装暂时未知。没有音箱（这个有些许意外，可能是我自己为仔细阅读，不过我重读时觉得界面并不清晰如果特别仔细看都有点可能像我一样觉得意外）
1460	3	怎么说呢，家用还不错，本来想给4星或者5星的，但是这款机器有两点很蛋-疼的地方 1：号称带了独立显卡，但是其实这个独立显卡跟核显的性能基本一样。。。。。。 真是日-了-狗-了 2：机子本身不带扬声器，显示器上有，但是。。。。。。。。。。。。。        机子和显示器都尼-玛没有音频线。。。。。。。。。。。。。。。。         更日-了-狗-了的是，机子的hdmi借口没有音频输出，即使你用hdmi线连接了显示器和主机          你得到的还是一个哑巴，你必须再买一套音频线，或者再买一个音响，你的电脑才能有声音 3：win 10系统还不是干净的，装了一堆垃圾软件在里面，
1461	3	快递还能漏发的，也是#
1462	3	识别不了麦克风，不知道什么原因
1463	2	刚刚拿到电脑，四千多的电脑13万分
1464	2	刚下个steam就卡黑屏了
1465	3	#显示器太烂，多少年代了还买这么丑的显示器，我真想抽自己嘴巴
1466	3	物流公司真的是非常快，下单6个小时左右就送货上门了。电脑显卡有问题，已成功退货，感谢客服的辛勤工作及热情接待！购物体验总体还是可以！
1467	3	电脑预装的Windows10系统不太会用 ，只分两个盘cd盘，感觉系统装的有点偷工减料，敷衍了事。
1468	3	戴尔机器其实还好，就是内置垃圾软件太多，再好的机器开机都开半天，慢的很
1469	2	电脑质量超级不好，前面连续来了两个都有明显质量问题，这个暂时未发现问题，不知道是不是退回去的问题商品，他们重新包装，重新售出的原因
1470	3	因有固态硬盘，开机速度可以，显示器太垃圾。
1471	2	机箱外观：小巧，还不错。 性能配置：够用了。 散热性能：行吧！ 跑分评测：哦！不玩游戏，看不到。 售后服务：很差，就是敷衍。 其他特色：无。
1472	3	电脑不行，一堆软件安装不了。先是photoshop,然后是美图秀秀批处理。几台电脑，其他都没事，完全可以。
1473	3	电脑安好没一会键盘就不能用了，不知道是什么情况，各种方式都试过了，咨询客服也无济于事，拨打技术电话还有时间限制，目前还未解决，待有结果后再评价
1474	3	东西还好，今天看价，买贵了，300元能忍受，买贵500，不能忍，差评！
1475	3	玩游戏一般，不能电脑吃鸡，魔兽玩着不能画质高了，不过还是相信品牌
1476	3	双十一下的订单，10几天以后才收到的货。京东也没有给出具体原因。收到货后，发现这个主机也太小了，很意外。查看了一下硬盘，机械硬盘只有931G，SSD硬盘只有104G，跟128G/1T相差很远吗吧。不过，电脑的速度还行。
1477	2	京东快递一如既往的给力，但是这款机显卡入门级，而且人工咨询客服，完全没反应，在微信公众号上咨询硬盘分区，工程师半天答一句，后面干脆不回答了。还是我自己请教朋友弄好分区的，晓得是这种态度，绝逼不买戴尔的。
1478	3	开机后发现几个问题:1.硬盘没有分区2.OFFICE只有一个月的使用期，一个月后需要自行购买，3，主机做工也不好，看上去不够精致，相当粗糙。4.现在是国庆假期，戴尔的800电话没人接听。
1479	3	先说一下这个电脑，机箱也是小机箱，主板B360,8pin供电，CUP4pin，不是标准M-ATX尺寸，固态硬盘是定制的，直接集成到主板，机械硬盘也是由主板供电，所以原装电源也是定制的。自己升级了微星GTX1660ti，换了450w电源。显卡不能用大的，电源需要~买24pin转8pin的戴尔转接线，CUP可以不用转接，直接插一半。电源位置**，标准电源放进去插头位置和机箱边缘会重叠，装不到位，一开始买的至尊酷冷完全放不进去，换了安钛克的勉强可以，但也只能拧两个螺丝。我这个是单位电脑，总的来说商务机是不适合升级的，办公用可以，想自己玩还是自己攒好点。虽然比品牌贵
1480	3	运行还可以，开机比较快，运转比较静音。就是做工真心不如以前了，再有就是各种简配，后面竟然连3.0usb端口 都没有？display port 接口也没有，甚至连HDMI 线也没有配。4000多的主机这也是太坑了。显示器很一般，直接买了别的。
1481	3	电脑预装的Windows10系统不太会用 ，只分两个盘cd盘，感觉系统装的有点偷工减料，敷衍了事。
1482	3	电脑安好没一会键盘就不能用了，不知道是什么情况，各种方式都试过了，咨询客服也无济于事，拨打技术电话还有时间限制，目前还未解决，待有结果后再评价
1483	3	买来办公室用的，看着还不错，已经装好软件，还没复制资料
1484	3	整体感觉还可以，没有什么毛病，就是感觉下载东西特慢，测试网速又很快，不知道是什么原因？
1485	3	主机小巧玲珑，速度很快，用起来很顺手。但是不知道为什么没有光驱，不能刻录，办公用起来很不方便，因为经常要刻盘上报文件。
1486	3	外观和质量看着不错，价格较贵没有性价比，机箱较小很静音，几乎没有热量，内置WIFI和蓝牙，开机10秒，搭配的屏幕外观漂亮但接口太少、也不够清晰细腻，键盘一般，鼠标按键生硬不如罗技的，总之主机不错屏幕一般，另外没有任何的赠品，鼠标垫都没有。
1487	3	机箱外观：一般 性能配置：一般
1488	3	正在使用，后期评价
1489	3	正在摸索使用中，过几天在追评
1490	2	显卡跑分很低呀
1491	2	不怎么样，外观不错而已
1492	3	帮朋友买的，系统要优化，不然卡爆
1493	3	做工一般
1494	3	速度一般
1495	3	单位采购
1496	2	首先说快递很快，服务很好，唯一美中不足就是电脑主机箱漏电，东西退了。
1497	2	运行还不错，挺快的，就是有时候噪音挺大的，影响心情
1498	2	说一点，这个操作系统是win10家庭版的，想商务用的话最好不要买。而且不会给你更换系统，请知悉。
1499	2	除了开机速度快了，其他使用真没觉得比我办公室2G内存的快到哪里去，早知道还不如买个普通配置的
1500	3	先是开机后黑屏只有鼠标，然后就是Office@创建帐户的各种输入，更可恨的是要输入一长串看到的图形字母，输了不知多少遍!把电脑砸了的心都有了!不知是选择京东错还是选择联想错!我看不是Win10是yin10!
1501	2	送货来的挺快的，就是刚装上，一启动就整个房间断电，然后电来了，又启动，又断电，应该是里面短路了，联系售后换，最后给换了一台新的，还不错，启动在10s之内
1502	3	主机开机需要两次才能登录
1503	2	屏幕有明显亮边！
1504	2	售后太差，其他还好
1505	3	还没有使用，物流出现了小插曲
1506	3	键盘和鼠标 真不好
1507	3	7月31日的购买，一个月了发票怎么还未寄出。
1508	3	搞飞机 不能装win7，买了个废品
1509	3	刚买回来第二天就死机了，啥情况啊
1510	3	显示器无法调倾斜度，大家购买时要注意了
1511	3	买贵了，退了差价，服务不错，电脑有点卡。
1512	3	东西太一般，运行个cad还有点卡，
1513	3	公司电脑使用人反馈偶尔死机，不知道为什么？
1514	2	写的是蓝牙的耳机和键盘，为啥到的是有线的呢
1515	3	秒杀买的，结果秒杀结束后，价格和秒杀时没有变化，京东玩的什么招数？
1516	2	使用过程中有一次死机，本人从不游戏！
1517	2	收到货第二天开机就黑屏，伤心。好在退掉了
1518	2	为什么刚买一天就降了一100元.要求补差价，请快帮处理。
1519	3	价格不便宜
1520	3	不便宜
1521	3	价格不便宜
1522	3	质量一般
1523	3	不建议买
1524	3	没有声音
1525	3	开机慢，固态硬盘好像没有起到作用，不怎么样
1526	2	作为一台商务电脑他是不合格的，我才买了几天呀，它就开始死机了。
1527	3	主机散热差，CPU温度达到72度！不知是不是正常？？？？！！
1528	3	贵
1529	3	买回不到一个月主机出现异响，联系客服全是自动回复，不是说终身****吗
1530	2	电脑只能用win10系统换不了win7系统， 办公用的第三方软件都装不上
1531	3	联想这款质量真的不乐观，买回来没多长时间显示器就有问题。
1532	3	机箱发烫厉害，散热不是太好，尤其是顶部，冬天可以暖手
1533	3	第一，实物和宣传图片不符。第二，讲有1T，事实只有930。后期使用再跟进
1534	2	主机还可以，蓝牙不能用，维修又费劲，只能不修了，就给两星吧
1535	3	鼠标左键有点不灵，而且买完没两天就降价了，你这这这，整体还不错，再用用看
1536	3	少了一颗螺丝。。???
1537	3	配置使用速度快，但是塑料感太强显廉价，还有显示器的电源变压器在插头处使用超级不方便
1538	3	配置使用速度快，但是塑料感太强显廉价，还有显示器的电源变压器在插头处使用超级不方便
1539	3	配置使用速度快，但是塑料感太强显廉价，还有显示器的电源变压器在插头处使用超级不方便
1540	2	运转速度挺快，但是机箱发烫严重散热差。长期使用肯定有问题
1541	3	除了卡，其他没毛病，就是运输过程中，屏幕上面有些开裂，不影响使用就算了
1542	2	为什么刚买的电脑主机不断发出滋滋的电流声，影响正常使用，尤其晚上，不是应该静音的那种吗？
1543	3	屏幕分辨率不够，效果很一般。主机性能还好，没空倒腾先用着，有情况在追评。物流外箱有点脏～
1544	3	使用正常，目前没发现大问题。但之后发票配送到的时候已经被私自打开，而且部分被撕坏了。幸好没大损失。已向客服投诉，对京东配送一直放心，但这次使我多了一些顾虑，如果配送的是小件贵重物品，后果难以想象。
1545	3	预装的win10不是一般的难用，各种操作不习惯，各种软件装不上，想换个win7各种重装不了
1546	3	5K的办公机觉得应该还是可以的，运行速度不错，就是风扇声音有点大，一直听着不太舒服。刚买完没几天就降价了，觉得有点小亏
1547	3	还行吧，用来一个星期左右，主机有问题换新了，打联想售后屁用没有，不来修，没办法联系京东换新了，幸好京东还靠谱点
1548	3	买了不到一个月，偶尔会卡住，感觉配置虽然可以，但好像没达到？也没打开很多东西，就是正常办公，就有偶尔没响应。。。感觉没有达到期望。
1549	3	机器还行 挺稳定  但是声音真响 买电脑一直想买个声音轻的 换过了 还这样 算了 将就的用吧 看小说的时候机器声音大的话很闹心
1550	3	外观还可以，但内部太偷工减料了，想加个光驱，发现电源接口没有多的，主板上的扩展槽全省掉，如果网卡坏了，只有用usb的联想为了节约成本已经发挥到极致了。想购买的建议选其他品牌的吧！
1551	2	这台电脑预装系统家庭版的，一些设计装软件装不上，总是有各种问题，找客服升级专业版的说要另外购买。。显示器不是很好，看半天眼睛不舒服，屏幕有些刺眼，其他还行
1552	2	拿到电脑装了一个下午，开机需要程序特别慢，开机速度挺快的，屏幕也挺大，玩半天主机也不热，但是屏幕的上面边缘炸开了一个口子，问客服客服说让我把电脑抱到附近售后去修，然后没解决，买后没多久就降价了，感觉好不直
1553	3	联想让我越来越失望了，下次不会购买了
1554	2	缓慢缓慢的，有点小失望
1555	3	鼠标和键盘太垃圾了
1556	2	显示器太差了，接口落后一个世纪
1557	3	看视频画面会卡，这点很不爽，对不起4999的价格
1558	2	不得不给差评，裂开的地方多，无语了，
1559	3	有史以来物流，发票最慢最慢的一次，虽然评价，但发票还没收到
1560	3	刚买了就降价！5199买的，一台降100元，我买了两台，这差距也太大了吧！
1561	3	没到一个月，降价200，还不给保价，京东越来越坑了，无语了
1562	3	机器运行EXCEL文件时反应很慢，与实际配置不是很相符。
1563	3	价格像乱定的一样，一天一个样，浮动好大，给的感觉是不靠谱
1564	3	有点失望，太慢了，太卡了，这个版本这不好用，买错了啊
1565	3	快递超慢，联系好几次都没有结果，周末没派送，等到周一，结果周一没有用到。具体刚用，还没有长期使用，待评价
1566	2	真心不想用WIN10系统，好多软件无法兼容，WIN7竟然不能用，这是几个意思？
1567	2	键盘鼠标太差了！！！设计不好，一点都不好打字，一点都不像大品牌的质感！很廉价的杂牌的键盘
1568	3	给三星完全是因为这个店铺的客服。电脑第一次发过来的时候，固态硬盘有问题导致开不了机。店铺客服居然让我致电联想售后工程师，我重申了一遍，是发过来的货有问题而且是硬件问题，然后店铺客服让我找就近的售后修理店。。我直接申请换货，来回折腾了一周。这次的购物体验不好。
1569	3	主机没的说，就是显示器边框间隙太大，很显然卡子没卡到位，看了很不舒服！
1570	3	无线网络老是掉线，运行速度也较慢，只有两个硬盘，没有分割，也没有授后服务，不符合大品牌的标准。
1571	2	配送人员周六打电话给我问我有没有人收货，我说没有，我的地址是办公楼，周末没人上班，他要我去公司给他收货，我在外地，我没法收，然后要我联系同事去公司收货，我说你要么把退回去要么就周一送，他和我说我明知道周末没人收货为什么还要下单，我说我怎么知道你们什么时候送到，然后我就投诉了，周六配送人员再次打电话，说周一配送，叮嘱我以后周五不要下单，我当时没说什么，今天送货再次和我说以后周五不要下单，配送人员太#，以后我下单前先请示配送员可不可以下单后再购买，奇葩
1572	3	机箱前面没有USB口，头一次碰到台式机机箱没有USB口的，真是比独特啊。本身带的杀毒软件不好使，什么软件不上安装，联系客服需要卸载。
1573	2	第一次给京东自营产品中差评，让自己取货不说了（大过年的快递小哥也不容易），说好的预装office呢？完全激活不了，京东微软联想问了一圈客服了，最后让我卸载了重新装预装软件，装就装吧，装好了提示我密钥已经被关联使用。。。真是服了，不会是二手机恢复的吧
1574	2	以为联想品牌不错才买；看了一下前面的评论，原来京东也是垃圾，前面都是优选的评论。电脑送来就感觉是仿品，外包装要不要那么粗糙？好不容易找到品牌是贴了一张小纸片，机箱的参数说明书在哪里？这也是产品？联想的操作软件植入里边使用相当不方便，感觉被绑架了。刚打开看到发票竟是东莞的一个贸易公司？我也是呵呵了。以后不会来京东买东西了
1575	2	第一次在京东买东西，失望！太失望了！近5000元的联想电脑就这样的品质？边框有明显缝隙，换了两次货才勉勉强强接受，京东的客服态度很好，但是不能用好的态度来填补产品质量的不足，本末倒置了！希望国产产品越来越好，支持国货，但请不要投机取巧，埋汰了我们的爱国心！
1576	2	现在还标730的显卡，前段时间买时没标，买回才知好垃圾的淘汰的显卡，电源也只有区区的180w，想换其它电源没门，因为电源是专用的10pin主板和4pin CPU接头，主板也是一大堆接口阉割了，不建买品牌机
1577	2	垃圾客服，电脑安装有问题，不解决，后来交涉后就让直接退货，后来找卖电脑的人看了下，联想电脑默认设置和网络运营商冲突，导致不能联网，人家设置改了下就好了，建议大件还是线下买的好，售后服务有保障，京东里就是卖东西的，不管售后服务的
1578	3	购物这么久第一次如此着急上火，我真的无语了。因为@office必须创建微软账户，问题出现在无法验证。找京东客服三次无法解释和解决，让我找联想售后，联想售后无法解决，让我找微软公司，微软公司也没说个所以然，辗转一个上午微软的第N个客服帮我创建@成功。这里我就说京东售后太差劲?，问什么都不确定。还有就是我不知道新的机器是否是人用过的？里面安装了游戏。
1579	3	很少给差评，但是这次购物结果很不满意，第一次是装系统卡死一个界面，第二次就是系统好了键盘失灵了&hellip;&hellip;说起来一把辛酸泪。快递速度态度都是没说的，包装也没问题，不过恰巧我这次要的不只是服务，在网购的世界里，我更喜欢&ldquo;锦上添花&rdquo;。
1580	3	只能说一般，玩个~游戏都玩不了害我各种折折腾，大型游戏还没玩，今天还显示内存不足，我才下了~，~视频，~音乐和一个全民K歌，这就内存不足？我也是醉了现在玩个~游戏老是程序无反应，还不知有什么问题，我又是个电脑小白，神啊救救我吧
1581	2	电脑外观漂亮、使用感受也不错。 不满意的地方有三点： 1.服务感觉不行，每次聊天，都是机器人回复，好不容易找到真人客服，又是很机械的回答，并没有真心为客户解决问题。 2.我11.8日下单时候，是4799元，优惠后4759元一直到11.15日才发货，可是11.11日当天，价格是4699元。多次协商想要回差价，都是申请失败。 3.最重要的是，说是11.1-11.11日期间购买电脑，在原来保修三年的基础上延长2年，也就是5年的保修。可是收到电脑后，客服说是只有3年，让我联系联想公司。我又联系联想那边，说是只有3年保修，他们并没有宣传说是延长2年。到现在成了一句空话。我想说的是，许诺了就要做到，否则就不要承诺。 总体来说就是对电脑满意，但是服务水平还有待提高。
1582	3	主机有点声音，不是静音，前面usb接口插移动硬盘不显示，插后面的接口能显示，问了线上的技术售后很长时间，试了很多操作，前面插移动硬盘还是不能显示，因为着急用电脑，后面插口又能用，就懒得退了
1583	2	坐而联想不如奋起华为
1584	2	散热性能：散热贼差，玩一会主机摸一下都能煎鸡蛋了。性能配置：~多开几个就卡的不要不要的
1585	3	一般
1586	3	性能配置：挺不错很流畅， 散热性能：散热一般，比我办公室集中采购的机子散热差多了 机箱外观：同款，但却比我办公室的机子机箱小，散热也差。
1587	3	机箱不错，显示器不是很理想，支架有用过的痕迹，不知道是不是新的，懒得换了。
1588	3	机子感觉还可以，想吐槽的是~售后客服、很难接入，绝对给差评的。尝试链接了半个小时。都没等到。我自己~解决的。没有品牌的感觉。就像街边货卖出去就好了。
1589	2	体验了一个月 总体一般 开机速度是可以挺快的 但是这个散热系统真的不行  所有软件全部关掉 就开个lol cpu温度居然能达到78度 给客服打电话 说90度以内都是没有问题的 机箱温度也高
1590	3	主机小巧玲珑，速度很快，用起来很顺手。但是不知道为什么没有光驱，不能刻录，办公用起来很不方便，因为经常要刻盘上报文件。
1591	3	运行速度很卡
1592	3	机箱外观：不错，小巧精致！ 性能配置：一般。 其他特色：系统系统太垃圾了，里面植入过多的联想应用。
1593	3	开机速度超级慢，别的没有了，能满足DOTA足球
1594	3	给爸爸买的，还不错，性价比挺高了～屏幕挺大的了，上班处理文件够用了
1595	3	电脑不错，联想这个牌子还比较靠谱，就是有点瞎！不帮华为，帮外国人？呵呵呵呵呵呵呵呵。
1596	3	配置太低，只是放放英语，上上网等。外观还行，紧凑。
1597	3	这款电脑已经买了3次了，东西用着肯定没有510S的好，一份价钱一分货，不过这送货的速度，虽说是京东自营，但这速度真不敢保证了
1598	3	刚刚买好19.5寸，安装好软件，第二天发现21.5竟然比19.5还要便宜1
1599	3	给家人买的，跟我说开机慢的要死，再一次对联想失望，以后再也不图省事买品牌机了，有这个钱自己配要好多。机箱小巧，这点不错
1600	3	名族品牌，外形小巧美观！做工精良！价格实惠！正版软件！装机繁琐，各种注册登录，烦人！windows 10体验一般，整体运行很慢！！只能简单办公了！
1601	3	机箱挺小的，电源的功率较低，170瓦左右，应该是刚好够用，显示器边框较大，电脑开机很快，运行速度一般，感觉不够流畅。
1602	3	看个网页还可以，开个WORD文档都卡的不要不要的，好得2000块。之前看别人评论说这机子还不如五年前的，我就不信，怎么说现在电脑更新速度快，技术提升大，也是4G内存的，不至于吧。贪便宜的我就买，嘿，还真的跟别人说的一样。
1603	2	我2015年花了3400买了一个981G的笔记本。我2019年花了3500多买了个笔记本。
1604	3	太小了办公够吗&hellip;&hellip;&hellip;&hellip;
1605	2	京东的服务不错，但电脑真的不行
1606	3	老是卡，也许是机子配置问题
1607	3	还可以吧，不知道后期会不会有问题
1608	3	帮公司买来办公用的，应该还可以吧！哈哈哈哈
1609	3	一般般吧，我就是用来做点最基本的办公用，
1610	3	还行吧，真的不能帮我装个软件？妈的
1611	3	ADC啊
